{
  "schemaVersion": "ckb-historical-reference-evidence-v1",
  "referenceCommit": "7b525374936a53dba5f1a19e0709a91cfe5b02ac",
  "modelProfileRole": "student_model_transport_profile",
  "modelProfileCount": 164,
  "modelEffort": "max",
  "maxBudgetUsdState": "empty_all_164",
  "modelBudgetDerivation": "empty_maxBudgetUsd_means_runner_amount_limit_unset",
  "timeoutSeconds": 3600,
  "promptRole": "student_final_prompt",
  "promptCount": 164,
  "promptAggregation": "relative_path_tab_sha256_newline_c_sort",
  "promptHash": "sha256:ead9caab8e06210cf513b2785b4ddd1273ad93d1a790968033309399e779bdba",
  "vectorRole": "frozen_runtime_vector_reconcile_current",
  "vectorProofHash": "sha256:f22e6110f8d6b8a5562b45ed1cde138e38169455a3cc8b4eb50d4ac02a165808",
  "vectorState": "ready",
  "vectorTotal": 7978,
  "vectorDimension": 1024,
  "vectorFailed": 0,
  "runCriticalRole": "reference_commit_run_critical_sources",
  "runCriticalCount": 27,
  "runCriticalAggregation": "relative_path_tab_sha256_newline_c_sort",
  "runCriticalTreeHash": "sha256:be5aab72f3e477a1d23aa1f3f53c79f701dfaad5dfc361c44ae7b4ba24458fc2",
  "runCriticalFiles": [
    {"path":"src/cangjie_capability.cj","sha256":"sha256:044f627163316cc4fb8e34909c1da3ea0cc96a76f92b5bdbcc1c3751ff19ccaf"},
    {"path":"src/cangjie_certification_preflight.cj","sha256":"sha256:a2245e1de94166b6230efe14ea8d1c3895738a316c5e692447435a7e945668d9"},
    {"path":"src/cangjie_eval_abcde_runner.cj","sha256":"sha256:b2c754b556440c2d500e35284674544eeaf8b612f0a026a73460b8d41be9598c"},
    {"path":"src/cangjie_eval_knowledge_audit.cj","sha256":"sha256:de1ed91483fdda2eade6939208098d6e89f28af4d0eac0527812748f3ad20e73"},
    {"path":"src/cangjie_first_initialization.cj","sha256":"sha256:12090d66f4098539635984fd980a45c860f03281362b3fdfb314a68eb48d711d"},
    {"path":"src/cangjie_humaneval_manifest.cj","sha256":"sha256:3a35dc7bb3ec0522ea48fd8daf71bda56ccd2fd8f9660b4097f6a8c111c71148"},
    {"path":"src/cangjie_interface_results.cj","sha256":"sha256:74d6f98b918cce1a93c145fa1cbaf3dbd7c6a6429c96226fb036a5b8c09c0af9"},
    {"path":"src/cangjie_release_gate.cj","sha256":"sha256:d3192c8fac69ca5a53c6320e6d85a5fa1df7b73e9ea8097df2418f569d234ae7"},
    {"path":"src/cangjie_retrieval_ranker.cj","sha256":"sha256:188806cbab3a49475bc1281e3f2a4f0d9401c5e8184a259c9df09c4a8be7fb9c"},
    {"path":"src/cangjie_routine_clean_candidate.cj","sha256":"sha256:521bae8573eeb6034b080ae6e27f915ed64a61c3d5bf6c53a59af7e9b9e47618"},
    {"path":"src/cangjie_serving_client.cj","sha256":"sha256:92a53b3c37ac9ce97170a8efb513ebc650e943b2b0832e83080b8d87e293bb4e"},
    {"path":"src/cangjie_serving_index.cj","sha256":"sha256:971f988a24d6a55978d1ae4eaa68649570e3a7ac49527110f6b4c3428cd2ba1c"},
    {"path":"src/cangjie_serving_query.cj","sha256":"sha256:930911be23ef0af82fd5f1dbb5d1db7cfb950b8efe64ce2554ee918b83f5d6b4"},
    {"path":"src/cangjie_strict_certification.cj","sha256":"sha256:631a0ffc1d472d72867bb4635046632ce79b72a5dc5e470339c942359f0ef8bf"},
    {"path":"src/cangjie_task_knowledge_builder.cj","sha256":"sha256:2238956a0cb172e6dc72beabb686bd78441345e249021d9d61db285f049e570e"},
    {"path":"src/cangjie_typed_records.cj","sha256":"sha256:fc914567f35fe8aed3b0d9e1b74afa2cb9be8117d527871ad441332e31d7a136"},
    {"path":"src/ckb_candidate_runtime_materialize.cj","sha256":"sha256:7cb1f82e8f00ff279e114c31cd304f7cd06547cffc96a553a57c3d5b4c7fe4ae"},
    {"path":"src/core.cj","sha256":"sha256:da180412a4626a736f2a33135eeb127b813a69929420a1730e9336415711a632"},
    {"path":"src/main.cj","sha256":"sha256:f6b183398c20650d63a971d1dae313c96f8985b58dd40b5e9108bab74f258e2d"},
    {"path":"src/mcp_http.cj","sha256":"sha256:3e2c558698028d3bc94da6325333eb0544347c5a8cf5e738fd4fdaeb0514df57"},
    {"path":"src/mcp_protocol.cj","sha256":"sha256:a3999ae81aa7902acc73aa85fd8bc05afeb1eee8f9fe9c58f27af8f9ac18b5e3"},
    {"path":"src/mcp_stdio.cj","sha256":"sha256:ce72ddafce8911149550638cf57754aaf1842ad7098e7bddbb7d8a2ddc3e1052"},
    {"path":"src/native_http_transport.cj","sha256":"sha256:d153a5f7e720298b604daec5a08dc7f7df5b37cf4f39f4611b179d5e4f8c71a3"},
    {"path":"src/native_tls_bootstrap.cj","sha256":"sha256:1676be18d86517c254c590cba72e9e231ed0dc197ff4e99fb02e10052350df3d"},
    {"path":"src/service_api.cj","sha256":"sha256:d6b767a7e5df190b48f9e573298cf0793e857595c93daa512dfe04a180a7f780"},
    {"path":"src/service_http.cj","sha256":"sha256:a733662364b7f539226f6c61ff183ff286c5b5f73fb8cffc046ab3c2298f18ab"},
    {"path":"src/services.cj","sha256":"sha256:d9d4a7c43827c17eccebe29069deb6a494c29870453e6ce6c1c306b93b832de3"}
  ]
}
